{"contract_id":"710b05bf95c2d56572d5f8d9c5cd64c0ce3f9b78d1a8a57d157ff9885a0df544","firmware_commit":"9eabb01b24687e935904c5dd9fa64ce0f18659fb","publications":[{"topic":"/fmu/out/airspeed_validated","type":"px4_msgs::msg::AirspeedValidated"},{"topic":"/fmu/out/arming_check_request","type":"px4_msgs::msg::ArmingCheckRequest"},{"topic":"/fmu/out/battery_status","type":"px4_msgs::msg::BatteryStatus"},{"topic":"/fmu/out/collision_constraints","type":"px4_msgs::msg::CollisionConstraints"},{"topic":"/fmu/out/estimator_event_flags","type":"px4_msgs::msg::EstimatorEventFlags"},{"topic":"/fmu/out/estimator_sensor_bias","type":"px4_msgs::msg::EstimatorSensorBias"},{"topic":"/fmu/out/estimator_status","type":"px4_msgs::msg::EstimatorStatus"},{"topic":"/fmu/out/estimator_status_flags","type":"px4_msgs::msg::EstimatorStatusFlags"},{"topic":"/fmu/out/failsafe_flags","type":"px4_msgs::msg::FailsafeFlags"},{"topic":"/fmu/out/home_position","type":"px4_msgs::msg::HomePosition"},{"topic":"/fmu/out/manual_control_setpoint","type":"px4_msgs::msg::ManualControlSetpoint"},{"topic":"/fmu/out/message_format_response","type":"px4_msgs::msg::MessageFormatResponse"},{"topic":"/fmu/out/mode_completed","type":"px4_msgs::msg::ModeCompleted"},{"topic":"/fmu/out/position_setpoint_triplet","type":"px4_msgs::msg::PositionSetpointTriplet"},{"topic":"/fmu/out/register_ext_component_reply","type":"px4_msgs::msg::RegisterExtComponentReply"},{"topic":"/fmu/out/sensor_combined","type":"px4_msgs::msg::SensorCombined"},{"topic":"/fmu/out/timesync_status","type":"px4_msgs::msg::TimesyncStatus"},{"topic":"/fmu/out/vehicle_acceleration","type":"px4_msgs::msg::VehicleAcceleration"},{"topic":"/fmu/out/vehicle_angular_velocity","type":"px4_msgs::msg::VehicleAngularVelocity"},{"topic":"/fmu/out/vehicle_attitude","type":"px4_msgs::msg::VehicleAttitude"},{"topic":"/fmu/out/vehicle_command_ack","type":"px4_msgs::msg::VehicleCommandAck"},{"topic":"/fmu/out/vehicle_control_mode","type":"px4_msgs::msg::VehicleControlMode"},{"topic":"/fmu/out/vehicle_global_position","type":"px4_msgs::msg::VehicleGlobalPosition"},{"topic":"/fmu/out/vehicle_gps_position","type":"px4_msgs::msg::SensorGps"},{"topic":"/fmu/out/vehicle_imu","type":"px4_msgs::msg::VehicleImu"},{"topic":"/fmu/out/vehicle_land_detected","type":"px4_msgs::msg::VehicleLandDetected"},{"topic":"/fmu/out/vehicle_local_position","type":"px4_msgs::msg::VehicleLocalPosition"},{"topic":"/fmu/out/vehicle_local_position_setpoint","type":"px4_msgs::msg::VehicleLocalPositionSetpoint"},{"topic":"/fmu/out/vehicle_odometry","type":"px4_msgs::msg::VehicleOdometry"},{"topic":"/fmu/out/vehicle_status","type":"px4_msgs::msg::VehicleStatus"},{"topic":"/fmu/out/vtol_vehicle_status","type":"px4_msgs::msg::VtolVehicleStatus"}],"schema":"iii.px4-dds-topics/v1","source":{"path":"src/modules/uxrce_dds_client/dds_topics.yaml","sha256":"3535532ec8e2dc7e3ee07f165fbfe12ecba1e4247c919855707d1f40749224a2"},"subscriptions":[{"topic":"/fmu/in/actuator_motors","type":"px4_msgs::msg::ActuatorMotors"},{"topic":"/fmu/in/actuator_servos","type":"px4_msgs::msg::ActuatorServos"},{"topic":"/fmu/in/arming_check_reply","type":"px4_msgs::msg::ArmingCheckReply"},{"topic":"/fmu/in/aux_global_position","type":"px4_msgs::msg::VehicleGlobalPosition"},{"topic":"/fmu/in/config_control_setpoints","type":"px4_msgs::msg::VehicleControlMode"},{"topic":"/fmu/in/config_overrides_request","type":"px4_msgs::msg::ConfigOverrides"},{"topic":"/fmu/in/distance_sensor","type":"px4_msgs::msg::DistanceSensor"},{"topic":"/fmu/in/goto_setpoint","type":"px4_msgs::msg::GotoSetpoint"},{"topic":"/fmu/in/manual_control_input","type":"px4_msgs::msg::ManualControlSetpoint"},{"topic":"/fmu/in/message_format_request","type":"px4_msgs::msg::MessageFormatRequest"},{"topic":"/fmu/in/mode_completed","type":"px4_msgs::msg::ModeCompleted"},{"topic":"/fmu/in/obstacle_distance","type":"px4_msgs::msg::ObstacleDistance"},{"topic":"/fmu/in/offboard_control_mode","type":"px4_msgs::msg::OffboardControlMode"},{"topic":"/fmu/in/onboard_computer_status","type":"px4_msgs::msg::OnboardComputerStatus"},{"topic":"/fmu/in/register_ext_component_request","type":"px4_msgs::msg::RegisterExtComponentRequest"},{"topic":"/fmu/in/sensor_optical_flow","type":"px4_msgs::msg::SensorOpticalFlow"},{"topic":"/fmu/in/sim_battery_charge","type":"px4_msgs::msg::SimBatteryCharge"},{"topic":"/fmu/in/telemetry_status","type":"px4_msgs::msg::TelemetryStatus"},{"topic":"/fmu/in/trajectory_setpoint","type":"px4_msgs::msg::TrajectorySetpoint"},{"topic":"/fmu/in/unregister_ext_component","type":"px4_msgs::msg::UnregisterExtComponent"},{"topic":"/fmu/in/vehicle_attitude_setpoint","type":"px4_msgs::msg::VehicleAttitudeSetpoint"},{"topic":"/fmu/in/vehicle_command","type":"px4_msgs::msg::VehicleCommand"},{"topic":"/fmu/in/vehicle_command_mode_executor","type":"px4_msgs::msg::VehicleCommand"},{"topic":"/fmu/in/vehicle_mocap_odometry","type":"px4_msgs::msg::VehicleOdometry"},{"topic":"/fmu/in/vehicle_rates_setpoint","type":"px4_msgs::msg::VehicleRatesSetpoint"},{"topic":"/fmu/in/vehicle_thrust_setpoint","type":"px4_msgs::msg::VehicleThrustSetpoint"},{"topic":"/fmu/in/vehicle_torque_setpoint","type":"px4_msgs::msg::VehicleTorqueSetpoint"},{"topic":"/fmu/in/vehicle_visual_odometry","type":"px4_msgs::msg::VehicleOdometry"}],"subscriptions_multi":[]}
